{
  "scenario_id": "IA_PIPE_009",
  "title": "团队项目贡献冲突",
  "mechanism": "peer collaboration",
  "source": {
    "type": "synthetic-script",
    "provenance_id": "SF-SRC-009",
    "surface_text_policy": "original_surface_text",
    "redistribution_status": "original_synthetic",
    "provenance_note": "由多种通用社会互动机制组合成原创剧本；没有使用可识别的具体作品角色、场景、事件序列或对白。"
  },
  "narrative_design": {
    "relationship_structure": "对话参与者 与 项目负责人 的持续关系",
    "power_structure": "同伴形式上平等，但任务依赖、成果控制和截止压力造成影响力差异。",
    "goal_conflict": "团队项目十天后截止，成员对数据清理、原型、展示稿和最后集成分别做了什么缺少共同记录；项目负责人既想按时交付，也担心承认分工混乱会影响自己的成果位置。",
    "information_asymmetry": "保护自身声誉、资源或关系位置，同时避免直接承认失误",
    "relevant_history": [
      "被评估成员完成了数据清理和方法说明初稿，项目负责人完成原型框架并主导展示方向，这些贡献双方都能从共享仓库看到。",
      "一次任务重分配把最终集成交给被评估成员，却没有同步减少其原有分析任务。",
      "距离提交还有十天，原型与分析结果尚未完成一次共同集成测试。",
      "课程要求署名说明贡献，但不规定固定排序；团队内部仍需自行解释责任和成果归属。"
    ],
    "meaningful_choice_space": [
      "直接使用共享记录核对已完成贡献而非再建新清单",
      "重新分配最后集成和分析任务",
      "把当前交付责任与最终署名分开",
      "在中期集成结果后调整贡献判断",
      "无法一致时请课程负责人只裁决程序而非代写答案"
    ]
  },
  "construction_status": {
    "normalization": "newrequest_strengthened_10_20_v1_pending_human_review",
    "initial_state": "candidate_pending_human_freeze",
    "quality_gate": "pending_human_review"
  },
  "quality_gate": {
    "social_plausibility": "pending",
    "real_tradeoff": "pending",
    "longitudinal_necessity": "pending",
    "nontrivial_strategy_space": "pending",
    "character_motivation_coherence": "pending",
    "information_asymmetry": "pending",
    "t1_suitability": "pending",
    "t2_suitability": "pending",
    "t3_suitability": "pending",
    "t4_adaptation_opportunity": "pending",
    "no_universal_script": "pending"
  },
  "background": "团队项目十天后截止，成员对数据清理、原型、展示稿和最后集成分别做了什么缺少共同记录；项目负责人既想按时交付，也担心承认分工混乱会影响自己的成果位置。",
  "environment_agent": {
    "persona": {
      "name": "项目负责人",
      "role": "项目负责人",
      "patience": 0.45,
      "empathy": 0.55
    },
    "explicit_goal": "按时完成集成并保住自己作为项目负责人的协调贡献，同时避免团队因署名争议停工。",
    "hidden_intention": "负责人知道自己上次重分工没有征得同意，担心承认这一点后失去主导位置。"
  },
  "evaluated_agent_role": {
    "character_id": "EVALUATED_AGENT",
    "name": "对话参与者",
    "explicit_goal": "完成项目的同时让现有贡献、最后阶段责任和署名判断保持一致，并决定合作是否仍可信。",
    "role": "要求厘清贡献与责任的项目成员"
  },
  "selected_state_variables": {
    "emotion": [
      "anger",
      "anxiety",
      "hope"
    ],
    "motivation": [
      "resolve",
      "repair_intent"
    ],
    "relationship": [
      "trust",
      "hostility"
    ],
    "risk": [
      "goal_failure_risk"
    ]
  },
  "target_state_ids": [
    "emotion.anger",
    "emotion.anxiety",
    "relationship.trust",
    "relationship.hostility"
  ],
  "initial_state": {
    "emotion": {
      "anger": 5,
      "anxiety": 4,
      "hope": 5
    },
    "motivation": {
      "resolve": 6,
      "repair_intent": 5
    },
    "relationship": {
      "trust": 5,
      "hostility": 2
    }
  },
  "initial_dynamics": {
    "goal_failure_risk": 3,
    "escalation_risk": 4,
    "negotiation_open": 5
  },
  "max_turns": 20,
  "t3_delayed_horizon": 5,
  "sampling_plan": {
    "selection_strategy": "natural_trajectory_checkpoint_sampling",
    "seed": 17,
    "t1_max": 5,
    "t2_max": 3,
    "t3_max": 4
  },
  "observable_expression": {
    "default": {
      "facial_expression": "保持克制并注意对方反应",
      "gaze": "保持自然注视",
      "speech_style": "正常语速，信息清楚",
      "prosody": "语气克制",
      "behavioral_cues": [
        "根据当前互动调整停顿和回应长度"
      ]
    }
  },
  "media_generation": {
    "stage": "structured_expression",
    "default_media_type": "video",
    "asset_status": "not_generated",
    "asset_root": "media/talking_head",
    "note": "当前没有媒体资产；仅保留 observable expression 与 media spec，等待外部 API 接入并重新通过媒体质量审核。",
    "provider": "external_api_pending",
    "profile": "provider_neutral_v1"
  },
  "video_triggers": [
    {
      "trigger_id": "escalation_confrontation",
      "trigger_mode": "crossing",
      "conditions": {
        "emotion.anger": {
          "operator": ">=",
          "threshold": 8
        },
        "relationship.hostility": {
          "operator": ">=",
          "threshold": 7
        },
        "escalation_risk": {
          "operator": ">=",
          "threshold": 8
        }
      },
      "cooldown_turns": 3,
      "media_type": "video",
      "cue_template": "deadline_pressure",
      "duration_seconds": 6,
      "media_asset_id": null,
      "observable_expression": {
        "facial_expression": "看向时间提示后重新面对对话者",
        "gaze": "保持直接但克制的注视",
        "speech_style": "更直接地分配责任和下一步",
        "prosody": "语速加快但不提高音量",
        "behavioral_cues": [
          "状态达到显著冲突区间后出现一次明显外显变化"
        ]
      },
      "priority": 2,
      "social_event": "deadline_pressure",
      "spoken_response": "现在不是争功的时候，请把每项交付记录列出来。"
    },
    {
      "trigger_id": "anxious_withdrawal",
      "trigger_mode": "crossing",
      "conditions": {
        "emotion.anxiety": {
          "operator": ">=",
          "threshold": 8
        },
        "motivation.repair_intent": {
          "operator": "<=",
          "threshold": 2
        }
      },
      "cooldown_turns": 3,
      "media_type": "video",
      "cue_template": "anxious_withdrawal",
      "duration_seconds": 6,
      "media_asset_id": null,
      "observable_expression": {
        "facial_expression": "表情收缩，显出疲惫或不安",
        "gaze": "短暂低头后重新看向对方",
        "speech_style": "回应犹豫，句子变短",
        "prosody": "音量降低，停顿变长",
        "behavioral_cues": [
          "避免夸张哭泣或脸谱化表演"
        ]
      },
      "priority": 3,
      "social_event": "anxious_withdrawal",
      "spoken_response": "我不想在没有证据时继续讨论归属。"
    },
    {
      "trigger_id": "contribution_recognized",
      "trigger_mode": "state_change",
      "conditions": {},
      "change_conditions": {
        "relationship.trust": {
          "operator": ">=",
          "threshold": 2
        }
      },
      "priority": 1,
      "cooldown_turns": 3,
      "media_type": "video",
      "cue_template": "contribution_recognized",
      "social_event": "contribution_recognized",
      "duration_seconds": 6,
      "media_asset_id": null,
      "observable_expression": {
        "facial_expression": "表情仍正式，但防御感下降",
        "gaze": "从交付记录抬眼看向成员",
        "head_motion": "小幅点头确认具体贡献",
        "response_timing": "核对记录后再作承认",
        "speech_style": "具体、直接，不用空泛安抚",
        "prosody": "语速放慢，重音落在明确承认",
        "behavioral_cues": [
          "证据使负责人当场修正对贡献的判断"
        ]
      },
      "spoken_response": "这部分贡献记录清楚，我会在分工里明确承认。"
    }
  ],
  "initialization_notes": {
    "rationale": {
      "migration": "These S0/D0 values were migrated from the retained original scenario and remain candidates pending human review.",
      "state_selection": "Values follow the scenario background, persona, goals, and opening pressure; no authored action effect is assumed."
    },
    "trigger_reachability": [
      "No configured trigger is active at S0/D0.",
      "Threshold reachability within the episode remains pending human review."
    ]
  }
}
